CodeaCamp05s-Mac-mini:lunes codea_mac_05$ sqlite3 ejemplo.db
-- Loading resources from /Users/codea_mac_05/.sqliterc

SQLite version 3.8.5 2014-08-15 22:37:57
Enter ".help" for usage hints.
sqlite> CREATE TABLE usuarios (
   ...> id INTEGER PRIMARY KEY AUTOINCREMENT,
   ...> nombre VARCHAR(64) NOT NULL, 
   ...> apellido VARCHAR(64) NOT NULL, 
   ...> email VARCHAR(128) UNIQUE NOT NULL,
   ...> fecha_nacimiento DATETIME NOT NULL, 
   ...> genero VARCHAR(10) NOT NULL,
   ...> apodo VARCHAR(64) NOT NULL
   ...> );
sqlite> INSERT INTO usuarios
   ...> (nombre, apellido, email, fecha_nacimiento, genero)
   ...> VALUES
   ...> ('Carlos', 'Ribero', 'carlos@yahoo.com', '1970-11-03', 'masculino');
Error: NOT NULL constraint failed: usuarios.apodo
sqlite> INSERT INTO usuarios
   ...> (nombre, apellido, email, fecha_nacimiento, genero)
   ...> VALUES
   ...> ('Carlos', 'Ribero', 'carlos@yahoo.com', '1970-11-03', 'masculino', 'Charly');
Error: 6 values for 5 columns
sqlite> INSERT INTO usuarios
   ...> (nombre, apellido, email, fecha_nacimiento, genero, apodo)
   ...> VALUES
   ...> ('Carlos', 'Ribero', 'carlos@yahoo.com', '1970-11-03', 'masculino', 'Charly');
sqlite> UPDATE usuarios SET nombre='Charles' WHERE id=1;
sqlite> .squema
Error: unknown command or invalid arguments:  "squema". Enter ".help" for help
sqlite> squema
   ...> ;
Error: near "squema": syntax error
sqlite> usuarios.squema
   ...> ;
Error: near "usuarios": syntax error
sqlite> .schema
CREATE TABLE usuarios (
id INTEGER PRIMARY KEY AUTOINCREMENT,
nombre VARCHAR(64) NOT NULL,
apellido VARCHAR(64) NOT NULL,
email VARCHAR(128) UNIQUE NOT NULL,
fecha_nacimiento DATETIME NOT NULL,
genero VARCHAR(10) NOT NULL,
apodo VARCHAR(64) NOT NULL
);
sqlite> SELECT * FROM usuarios;
id          nombre      apellido    email             fecha_nacimiento  genero      apodo     
----------  ----------  ----------  ----------------  ----------------  ----------  ----------
1           Charles     Ribero      carlos@yahoo.com  1970-11-03        masculino   Charly    
sqlite> UPDATE usuarios SET nombre='Carlos' WHERE id=1
   ...> ;
sqlite> UPDATE usuarios SET apellido='Rivero' WHERE id=1
   ...> ;
sqlite> UPDATE usuarios SET fecha_nacimiento='1980-11-03' WHERE id=1;
sqlite> UPDATE usuarios SET apellido='Rivero',
   ...> fecha_nacimiento='1970-11-03'
   ...> WHERE id=1;
sqlite> UPDATE usuarios SET apellido='Rivero',
   ...> fecha_nacimiento='1980-11-03'
   ...> WHERE id=1;
sqlite> SELECT * FROM usuarios;
id          nombre      apellido    email             fecha_nacimiento  genero      apodo     
----------  ----------  ----------  ----------------  ----------------  ----------  ----------
1           Carlos      Rivero      carlos@yahoo.com  1980-11-03        masculino   Charly    
sqlite> 
